name,description,link,category
Geocode.xyz,"Provides worldwide forward/reverse geocoding, batch geocoding and geoparsing",https://geocode.xyz/api,Location
Graph Countries,"Country-related data like currencies, languages, flags, regions+subregions and bordering countries",https://github.com/lennertVanSever/graphcountries,Location
IPGeolocationAPI.com,Locate your visitors by IP with country details,https://ipgeolocationapi.com/,Location
Mexico,Mexico RESTful zip codes API,https://github.com/IcaliaLabs/sepomex,Location
FreeGeoIP,"Free geo ip information, no registration required. 15k/hour rate limit",https://freegeoip.app/,Location
IP Sidekick,Geolocation API that returns extra information about an IP address,https://ipsidekick.com,Location
Geoapify,"Forward and reverse geocoding, address autocomplete",https://www.geoapify.com/api/geocoding-api/,Location
Battuta,A country/region/city in-cascade location API,http://battuta.medunes.net,Location
IP Address Details,Find geolocation with ip address,https://ipinfo.io/,Location
Mapbox,Create/customize beautiful digital maps,https://www.mapbox.com/developers/,Location
Open Topo Data,Elevation and ocean depth for a latitude and longitude,https://www.opentopodata.org,Location
CitySDK,Open APIs for select European cities,http://www.citysdk.eu/citysdk-toolkit/,Location
IP Location,Find location with ip address,https://ipapi.co/api/#introduction,Location
SpotSense,Add location based interactions to your mobile app,https://www.spotsense.io,Location
adresse.data.gouv.fr,"Address database of France, geocoding and reverse",https://adresse.data.gouv.fr,Location
ipapi,Real-time Geolocation & Reverse IP Lookup REST API,https://ipapi.com/,Location
IP2Location,IP geolocation web service to get more than 55 parameters,https://www.ip2location.com/web-service/ip2location,Location
bng2latlong,Convert British OSGB36 easting and northing British National Grid to WGS84 latitude and longitude,https://www.getthedata.com/bng2latlong,Location
BigDataCloud,Provides fast and accurate IP geolocation APIs along with security checks and confidence area,https://www.bigdatacloud.com/ip-geolocation-apis,Location
QWeather,Location-based weather data,https://dev.qweather.com/,Weather
Openweathermap,Weather,https://openweathermap.org/api,Weather
openSenseMap,Data from Personal Weather Stations called senseBoxes,https://api.opensensemap.org/,Weather
TheRainery,Forecast models from meteorological institutes,https://therainery.com/documentation/,Weather
Troposphere,Global weather and climate data,https://www.troposphere.io/developer,Weather
AccuWeather,Weather and forecast data,https://developer.accuweather.com/apis,Weather
Meteorologisk Institutt,Weather and climate data,https://api.met.no/weatherapi/documentation,Weather
ColorfulClouds,Weather,https://open.caiyunapp.com/ColorfulClouds_Weather_API,Weather
AviationWeather,NOAA aviation weather forecasts and observations,https://www.aviationweather.gov/dataserver,Weather
Weatherbit,Weather,https://www.weatherbit.io/api,Weather
7Timer!,lang=en) | ,http://www.7timer.info/doc.php?lang=en,Weather
weatherstack,Real-Time & Historical World Weather Data API,https://weatherstack.com/,Weather
ODWeather,Weather and weather webcams,http://api.oceandrivers.com/static/docs.html,Weather
Storm Glass,Global marine weather from multiple sources,https://stormglass.io/,Weather
APIXU,Weather,https://www.apixu.com/doc/request.aspx,Weather
Visual Crossing,Global historical and weather forecast data,https://www.visualcrossing.com/weather-api,Weather
NOAA Climate Data,Weather and climate data,https://www.ncdc.noaa.gov/cdo-web/,Weather
OpenUV,Real-time UV Index Forecast,https://www.openuv.io,Weather
weather-api,A RESTful free API to check the weather,https://github.com/robertoduessmann/weather-api,Weather
MetaWeather,Weather,https://www.metaweather.com/api/,Weather
Foreca,Weather,https://developer.foreca.com,Weather
Coinmarketcap,Cryptocurrencies Prices,https://coinmarketcap.com/api/,Finance
Rig Veda,"Gods and poets, their categories, and the verse meters, with the mandal and sukta number",https://aninditabasu.github.io/indica/html/rv.html,Books
Open Library,"Books, book covers and related data",https://openlibrary.org/developers/api,Books
Bible,"RESTful Bible API with 7 versions, 4 languages and multiple features",https://bibleapi.co/,Books
Vedic Society,"Descriptions of all nouns (names, places, animals, things) from vedic literature",https://aninditabasu.github.io/indica/html/vs.html,Books
Crossref Metadata Search,Books & Articles Metadata,https://github.com/CrossRef/rest-api-doc,Books
Quran Cloud,"A RESTful Quran API to retrieve an Ayah, Surah, Juz or the enitre Holy Quran",https://alquran.cloud/api,Books
Google Books,Books,https://developers.google.com/books/,Books
Penguin Publishing,"Books, book covers and related data",http://www.penguinrandomhouse.biz/webservices/rest/,Books
Bhagavad Gita,Open Source Shrimad Bhagavad Gita API including 21+ authors translation in Sanskrit/English/Hindi,https://docs.bhagavadgitaapi.in,Books
Wolne Lektury,API for obtaining information about e-books available on the WolneLektury.pl website,https://wolnelektury.pl/api/,Books
Quran,RESTful Quran API with multiple languages,https://quran.api-docs.io/,Books
LibGen,Library Genesis search engine,https://garbage.world/posts/libgen/,Books
British National Bibliography,Books,http://bnb.data.bl.uk/,Books
Thirukkural,1330 Thirukkural poems and explanation in Tamil and English,https://api-thirukkural.web.app/,Books
Quran-api,Free Quran API Service with 90+ different languages and 400+ translations,https://github.com/fawazahmed0/quran-api#readme,Books
New York Times Books,Book reviews and The New York Times Best Sellers lists,https://developer.nytimes.com/docs/books-product/1/overview,Books
AlienVault Open Threat Exchange (OTX),IP/domain/URL reputation,OTX,Anti-Malware
Google Safe Browsing,Google Link/Domain Flagging,https://developers.google.com/safe-browsing/,Anti-Malware
AbuseIPDB,IP/domain/URL reputation,https://docs.abuseipdb.com/,Anti-Malware
URLScan.io,Scan and Analyse URLs,https://urlscan.io/about-api/,Anti-Malware
URLhaus,Bulk queries and Download Malware Samples,https://urlhaus-api.abuse.ch/,Anti-Malware
Metacert,Metacert Link Flagging,https://metacert.com/,Anti-Malware
VirusTotal,VirusTotal File/URL Analysis,https://www.virustotal.com/en/documentation/public-api/,Anti-Malware
PHP-Noise,Noise Background Image Generator,https://php-noise.com/,Art and Design
Art Institute of Chicago,Art,https://api.artic.edu/docs/,Art and Design
Rijksmuseum,Art,https://www.rijksmuseum.nl/en/api,Art and Design
Noun Project,Icons,http://api.thenounproject.com/index.html,Art and Design
Dribbble,Design,http://developer.dribbble.com/v2/,Art and Design
Iconfinder,Icons,https://developer.iconfinder.com,Art and Design
Pixel Encounter,SVG Icon Generator,https://pixelencounter.com/api,Art and Design
Europeana,European Museum and Galleries content,https://pro.europeana.eu/resources/apis/search,Art and Design
ColourLovers,"Get various patterns, palettes and images",http://www.colourlovers.com/api,Art and Design
Cooper Hewitt,Smithsonian Design Museum,https://collection.cooperhewitt.org/api,Art and Design
Harvard Art Museums,Art,https://github.com/harvardartmuseums/api-docs,Art and Design
Metropolitan Museum of Art,Met Museum of Art,https://metmuseum.github.io/,Art and Design
Icons8,Icons,http://docs.icons8.apiary.io/#reference/0/meta,Art and Design
Currency-api,Free Currency Exchange Rates API with 150+ Currencies & No Rate Limits,https://github.com/fawazahmed0/currency-api#readme,Currency
Blockchain,"Bitcoin Payment, Wallet & Transaction Data",https://www.blockchain.com/api,Currency
CoinRanking,Live Cryptocurrency data,https://docs.coinranking.com/,Currency
Cryptonator,Cryptocurrencies Exchange Rates,https://www.cryptonator.com/api/,Currency
Binance,Exchange for Trading Cryptocurrencies based in China,https://github.com/binance/binance-spot-api-docs,Currency
Coinlore,"Cryptocurrencies prices, volume and more",https://www.coinlore.com/cryptocurrency-data-api,Currency
VATComply.com,"Exchange rates, geolocation and VAT number validation",https://www.vatcomply.com/documentation,Currency
CoinCap,Real time Cryptocurrency prices through a RESTful API,https://docs.coincap.io/,Currency
Coinbase,"Bitcoin, Bitcoin Cash, Litecoin and Ethereum Prices",https://developers.coinbase.com,Currency
Czech National Bank,A collection of exchange rates,https://www.cnb.cz/cs/financni_trhy/devizovy_trh/kurzy_devizoveho_trhu/denni_kurz.xml,Currency
Coinbase Pro,Cryptocurrency Trading Platform,https://docs.pro.coinbase.com/#api,Currency
1Forge,Forex currency market data,https://1forge.com/forex-data-api/api-documentation,Currency
WorldCoinIndex,Cryptocurrencies Prices,https://www.worldcoinindex.com/apiservice,Currency
MercadoBitcoin,Brazilian Cryptocurrency Information,https://www.mercadobitcoin.net/api-doc/,Currency
ExchangeRate-API,Free currency conversion,https://www.exchangerate-api.com,Currency
CoinGecko,"Cryptocurrency Price, Market, and Developer/Social Data",http://www.coingecko.com/api,Currency
BitcoinCharts,Financial and Technical Data related to the Bitcoin Network,https://bitcoincharts.com/about/exchanges/,Currency
Coinlib,Crypto Currency Prices,https://coinlib.io/apidocs,Currency
CoinDesk,Bitcoin Price Index,http://www.coindesk.com/api/,Currency
BlockFacts,"Real-time crypto data from multiple exchanges via a single unified API, and much more",https://blockfacts.io/,Currency
Technical Analysis,Cryptocurrency prices and technical analysis,https://technical-analysis-api.com,Currency
CryptoMarket,Cryptocurrencies Trading platform,https://developers.cryptomkt.com,Currency
Poloniex,US based digital asset exchange,https://poloniex.com/support/api/,Currency
Coinigy,Interacting with Coinigy Accounts and Exchange Directly,https://coinigy.docs.apiary.io,Currency
Bittrex,Next Generation Crypto Trading Platform,https://bittrex.com/Home/Api,Currency
CoinStats,version=latest) | ,https://documenter.getpostman.com/view/5734027/RzZ6Hzr3?version=latest,Currency
VALR,Cryptocurrency Exchange based in South Africa,https://docs.valr.com/,Currency
Nexchange,Automated cryptocurrency exchange service,https://nexchange2.docs.apiary.io/,Currency
Currencylayer,Exchange rates and currency conversion,https://currencylayer.com/documentation,Currency
Gemini,Cryptocurrencies Exchange,https://docs.gemini.com/rest-api/,Currency
Nomics,Historical and realtime cryptocurrency prices and market data,https://nomics.com/docs/,Currency
WallstreetBets,WallstreetBets Stock Comments Sentiment Analysis,https://dashboard.nbshare.io/apps/reddit/api/,Currency
ICObench,"Various information on listing, ratings, stats, and more",https://icobench.com/developers,Currency
National Bank of Poland,A collection of currency exchange rates (data in XML and JSON),http://api.nbp.pl/en.html,Currency
Block,"Bitcoin Payment, Wallet & Transaction Data",https://www.block.io/docs/basic,Currency
CoinAPI,All Currency Exchanges integrate under a single api,https://docs.coinapi.io/,Currency
Exchangeratesapi.io,Exchange rates with currency conversion,https://exchangeratesapi.io,Currency
Coinpaprika,"Cryptocurrencies prices, volume and more",https://api.coinpaprika.com,Currency
Exchangerate.host,Free foreign exchange & crypto rates API,https://exchangerate.host,Currency
coinlayer,Real-time Crypto Currency Exchange Rates,https://coinlayer.com,Currency
BitcoinAverage,Digital Asset Price Data for the blockchain industry,https://apiv2.bitcoinaverage.com/,Currency
Bitmex,Real-Time Cryptocurrency derivatives trading platform based in Hong Kong,https://www.bitmex.com/app/apiOverview,Currency
Covalent,Multi-blockchain data aggregator,https://www.covalenthq.com/docs/api/,Currency
CryptoCompare,Cryptocurrencies Comparison,https://www.cryptocompare.com/api#,Currency
CurrencyScoop,Real-time and historical currency rates JSON API,https://currencyscoop.com/api-documentation,Currency
Bitfinex,Cryptocurrency Trading Platform,https://docs.bitfinex.com/docs,Currency
apilayer fixer.io,Exchange rates and currency conversion,https://fixer.io,Currency
Frankfurter,"Exchange rates, currency conversion and time series",https://www.frankfurter.app/docs,Currency
Intellexer,"Processing (NLP) Service including sentiment analysis, content extraction, and language detection",http://esapi.intellexer.com/,ML
WatchMouse API,Offers self-service website and application performance monitoring solutions,http://more.watchmouse.com/transaction_monitoring/,ML
Data Demograph,"Enrich your contact lists with intelligent demographics. Add gender age, income, education, ancestry, crime, and political leaning to your customer insights.",https://datademograph.com/,ML
Trash Nothing,A freecycling community with thousands of free items posted every day,https://trashnothing.com/developer,Social Media
Cisco Spark,Team Collaboration Software,https://developer.ciscospark.com,Social Media
Disqus,Communicate with Disqus data,https://disqus.com/api/docs/auth/,Social Media
Facebook API,"Helps developers build, grow and monetize their business.",https://developers.facebook.com/,Social Media
Telegram Bot,Simplified HTTP version of the MTProto API for bots,https://core.telegram.org/bots/api,Social Media
HackerNews,Social news for CS and entrepreneurship,https://github.com/HackerNews/API,Social Media
Pinterest,The world's catalog of ideas,https://developers.pinterest.com/,Social Media
Full Contact,Get Social Media profiles and contact Information,https://www.fullcontact.com/developer/docs/,Social Media
Discord,"Make bots for Discord, integrate Discord onto an external platform",https://discord.com/developers/docs/intro,Social Media
Saidit,Open Source Reddit Clone,https://www.saidit.net/dev/api,Social Media
Tumblr,Read and write Tumblr Data,https://www.tumblr.com/docs/en/api/v2,Social Media
Open Collective,Get Open Collective data,https://docs.opencollective.com/help/developers/api,Social Media
Telegram MTProto,Read and write Telegram data,https://core.telegram.org/api#getting-started,Social Media
Facebook,"Facebook Login, Share on FB, Social Plugins, Analytics and more",https://developers.facebook.com/,Social Media
Buffer,Access to pending and sent updates in Buffer,https://buffer.com/developers/api,Social Media
Twitch,Game Streaming API,https://dev.twitch.tv/docs,Social Media
Quora API,"Connect the people who have knowledge to the people who need it, to bring together people with different perspectives so they can understand each other better, and to empower everyone to share their knowledge for the benefit of the rest of the world.",https://edmondlausposts.quora.com/Quora-Extension-API,Social Media
vk,Read and write vk data,https://vk.com/dev/sites,Social Media
4chan,Simple image-based bulletin board dedicated to a variety of topics,https://github.com/4chan/4chan-API,Social Media
MySocialApp,"Seamless Social Networking features, API, SDK to any app",https://mysocialapp.io,Social Media
Twitter,Read and write Twitter data,https://developer.twitter.com/en/docs,Social Media
Instagram,"Instagram Login, Share on Instagram, Social Plugins and more",https://www.instagram.com/developer/,Social Media
Reddit,Homepage of the internet,https://www.reddit.com/dev/api,Social Media
Fuck Off as a Service,Asks someone to fuck off,https://www.foaas.com,Social Media
Meetup.com,Data about Meetups from Meetup.com,https://www.meetup.com/meetup_api/,Social Media
Slack,Team Instant Messaging,https://api.slack.com/,Social Media
Foursquare,"Interact with Foursquare users and places geolocation-based checkins, photos, tips, events, etc",https://developer.foursquare.com/,Social Media
UnixTime Converter,A REST API to convert UnixTime to DateTime and DateTime to UnixTime,https://unixtime.co.za,Calendar
Megavangelical,A (satirical) Evangelical liturgical calendar,https://megavangelicals.com/sundays.json,Calendar
Calendar Index,Worldwide Holidays and Working Days,https://www.calendarindex.com/,Calendar
Namedays Calendar,Provides namedays for multiple countries,https://nameday.abalin.net,Calendar
UK Bank Holidays,"Bank holidays in England and Wales, Scotland and Northern Ireland",https://www.gov.uk/bank-holidays.json,Calendar
Russian Calendar,Check if a date is a Russian holiday or not,https://github.com/egno/work-calendar,Calendar
Church Calendar,Catholic liturgical calendar,http://calapi.inadiutorium.cz/,Calendar
Nager.Date,Public holidays for more than 90 countries,https://date.nager.at,Calendar
Abstract Public Holidays,"Data on national, regional, and religious holidays via API",https://www.abstractapi.com/holidays-api,Calendar
Google Calendar,"Display, create and modify Google calendar events",https://developers.google.com/google-apps/calendar/,Calendar
LectServe,Protestant liturgical calendar,http://www.lectserve.com,Calendar
Hebrew Calendar,"Convert between Gregorian and Hebrew, fetch Shabbat and Holiday times, etc",https://www.hebcal.com/home/developer-apis,Calendar
Holidays,Historical data regarding holidays,https://holidayapi.com/,Calendar
Non-Working Days,"Simple REST API for checking working, non-working or short days for Russia, CIS, USA and other",https://isdayoff.ru,Calendar
Czech Namedays Calendar,Lookup for a name and returns nameday date,https://svatky.adresa.info,Calendar
Satellite Passes,Query next satellite passes above you,https://satellites.fly.dev,Science and Maths
arXiv,"Curated research-sharing platform: physics, mathematics, quantitative finance, and economics",https://arxiv.org/help/api/user-manual,Science and Maths
inspirehep.net,High Energy Physics info. system,https://github.com/inspirehep/rest-api-doc,Science and Maths
Open Notify,"ISS astronauts, current location, etc",http://open-notify.org/Open-Notify-API/,Science and Maths
NASA APOD (unofficial API),API for getting Astronomy Image of the Day images along with metadata,unofficial API,Science and Maths
USGS Water Services,Water quality and level info for rivers and lakes,https://waterservices.usgs.gov/,Science and Maths
hubblesite,Space Telescope News Releases,https://hubblesite.org/api/documentation/,Science and Maths
SHARE,"A free, open, dataset about research and scholarly activities",https://share.osf.io/api/v2/,Science and Maths
Sunrise and Sunset,Sunset and sunrise times for a given latitude and longitude,https://sunrise-sunset.org/api,Science and Maths
ITIS,Integrated Taxonomic Information System,https://www.itis.gov/ws_description.html,Science and Maths
NASA APOD (official API),api_key=DEMO_KEY) | ,official API,Science and Maths
GBIF,Global Biodiversity Information Facility,https://www.gbif.org/developer/summary,Science and Maths
CORE,Access the world's Open Access research papers,https://core.ac.uk/services#api,Science and Maths
arcsecond.io,Multiple astronomy data sources,https://api.arcsecond.io/,Science and Maths
World Bank,World Data,https://datahelpdesk.worldbank.org/knowledgebase/topics/125589,Science and Maths
Newton,Symbolic and Arithmetic Math Calculator,https://newton.now.sh/,Science and Maths
Open Science Framework,"Repository and archive for study designs, research materials, data, manuscripts, etc",https://developer.osf.io,Science and Maths
Numbers,"Number of the day, random number, number facts and anything else you want to do with numbers",https://math.tools/api/numbers/,Science and Maths
iDigBio,Access millions of museum specimens from organizations around the world,https://github.com/idigbio/idigbio-search-api/wiki,Science and Maths
isEven (humor),Check if a number is even,humor,Science and Maths
USGS Earthquake Hazards Program,Earthquakes data real-time,https://earthquake.usgs.gov/fdsnws/event/1/,Science and Maths
NASA,"NASA data, including imagery",https://api.nasa.gov,Science and Maths
Launch Library 2,Spaceflight launches and events database,https://thespacedevs.com/llapi,Science and Maths
Materials Platform for Data Science,Curated experimental data for materials science,https://mpds.io,Science and Maths
Purple Air,Real Time Air Quality Monitoring,https://www2.purpleair.com/,Science and Maths
SpaceX,"Company, vehicle, launchpad and launch data",https://github.com/r-spacex/SpaceX-API,Science and Maths
Minor Planet Center,Asterank.com Information,http://www.asterank.com/mpc,Science and Maths
Gmail,"Flexible, RESTful access to the user's inbox",https://developers.google.com/gmail/api/,Business
MailboxValidator,Validate email address to improve deliverability,https://www.mailboxvalidator.com/api-email-free,Business
ORB Intelligence,Company lookup,https://api.orb-intelligence.com/docs/,Business
Charity Search,Non-profit charity data,http://charityapi.orghunter.com/,Business
mailgun,Email Service,https://www.mailgun.com/,Business
Domainsdb.info,Registered Domain Names Search,https://domainsdb.info/,Business
Ticksel,Friendly website analytics made for humans,https://ticksel.com,Business
Google Analytics,"Collect, configure and analyze your data to reach the right audience",https://developers.google.com/analytics/,Business
Clearbit Logo,Search for company logos and embed them in your projects,https://clearbit.com/docs#logo-api,Business
Trello,"Boards, lists and cards to help you organize and prioritize your projects",https://developers.trello.com/,Business
Freelancer,Hire freelancers to get work done,https://developers.freelancer.com,Business
mail.tm,Temporary Email Service,https://docs.mail.tm,Business
Smartsheet,Allows you to programmatically access and Smartsheet data and account information,https://smartsheet-platform.github.io/api-docs/,Business
markerapi,Trademark Search,http://www.markerapi.com/,Business
SwiftKanban,"Kanban software, Visualize Work, Increase Organizations Lead Time, Throughput & Productivity",https://www.digite.com/swiftkanban/,Business
Zestful Data,"The Zestful's ingredient parser API turns plain recipe strings into beautiful, structured data. You can get 30 ingredient parses per day for free.",https://zestfuldata.com/,Food
The Meal Db,"This food API is free to use and can get you recipes, food details, food names , meals by category, food images and more!",https://www.themealdb.com/api.php,Food
Food Api,"Let’s you access over 330,000 recipes and 80,000 food products",https://spoonacular.com/food-api,Food
The Cocktail Db,"A fee API to query a db of 1000s of cocktails, you can search for recipes, images of specific cocktails, ingredients, filter by alcoholic, non alcoholic and more with the Cocktails DB.",https://www.thecocktaildb.com/api.php,Food
Trace.Moe,Scan anime image to get specific detail,https://soruly.github.io/trace.moe/,Anime
AnimeNewsNetwork,Anime industry news,https://www.animenewsnetwork.com/encyclopedia/api.php,Anime
Jikan,Unofficial MyAnimeList API,https://jikan.moe,Anime
AnimeChan,Anime quotes (over 10k+),https://github.com/RocktimSaikia/anime-chan,Anime
Shikimori,"Anime discovery, tracking, forum, rates",https://shikimori.one/api/doc,Anime
What Anime,Scan anime image to get specific detail,https://soruly.github.io/trace.moe/,Anime
Kitsu,Anime discovery platform,https://kitsu.docs.apiary.io/,Anime
AniList,Anime discovery & tracking,https://github.com/AniList/ApiV2-GraphQL-Docs,Anime
Waifu.pics,Image sharing platform for anime images,https://waifu.pics/docs,Anime
AniAPI,"Anime discovery, streaming & syncing with trackers",https://github.com/AniAPI-Team/AniAPI,Anime
MyAnimeList,cid=13727) | ,https://myanimelist.net/clubs.php?cid=13727,Anime
Studio Ghibli,Resources from Studio Ghibli films,https://ghibliapi.herokuapp.com,Anime
API2Cart,"API2Cart provides a unified shopping cart API for interaction between the eCommerce software and 30+ shopping carts including Magento, Shopify, WooCommerce, BigCommerce, OpenCart, PrestaShop and others.",https://api2cart.com/,Shopping
Etsy,Manage shop and interact with listings,https://www.etsy.com/developers/documentation/getting_started/api_basics,Shopping
Bratabase,Database of different types of Bra Sizes,https://developers.bratabase.com/,Shopping
Wegmans,Wegmans Food Markets,https://dev.wegmans.io,Shopping
Best Buy,"Products, Buying Options, Categories, Recommendations, Stores and Commerce",https://bestbuyapis.github.io/api-documentation/#overview,Shopping
Wal-Mart,Item price and availability,https://developer.walmartlabs.com/,Shopping
Dummy Products,An api to fetch dummy e-commerce products JSON data with placeholder images,https://dummyproducts-api.herokuapp.com/,Shopping
Furniture Store Data Api,The API is designed on a demo base for a furniture store repository which provides furniture store data against a token and name of the furniture store. The API is developed on C# and json. The great thing in this api is that it very simple to use and edit. You will learn how to provide any type of data via api in seconds. Prerequisites: Visual Studio 4.0 and above Functionality: Can let your user get data based on keyset and its value set by specifying any TokenKey and value on which basis the API request can be validated. The updated version of the API is also available at <a href='https://getrit.com'>getrit.com</a>,https://getrit.com/API/Token,Shopping
eBay,Sell and Buy on eBay,https://go.developer.ebay.com/,Shopping
FengShui,Let’s you enter your name and the name of your partner/lover/crush to find Love compatibility & chances of successful love relationship,https://fengshui-api.com/,Astrology
Html2pdf.App,"Free Html to Pdf online generator Most realistic, high quality html to pdf api service! Free API - no payments No need your own server Maintainable and improving service Easy to use",https://html2pdf.app/,Miscellaneous
Shutterstock,"The Shutterstock API provides access to Shutterstock's library of media, as well as information about customers' accounts and the contributors that provide the media. It allows customer platforms to search for media, view information and previews for the media, and license and download media.",https://www.shutterstock.com/developers/,Miscellaneous
