name,description,link,category
Omdb,"The Open Movie Database API. The OMDb API is a RESTful web service to obtain movie information, all content and images on the site are contributed and maintained by our users.",https://www.omdbapi.com/,Entertainment
Deck of Cards,Deck of Cards,http://deckofcardsapi.com/,Entertainment
Animal Crossing: New Horizons,"API for critters, fossils, art, music, furniture and villagers",http://acnhapi.com/,Entertainment
Hearthstone,Hearthstone Cards Information,http://hearthstoneapi.com/,Entertainment
Random Facts,Random Facts from hundreds of categories,https://fungenerators.com/api/facts/,Entertainment
Final Fantasy XIV,Final Fantasy XIV Game data API,https://xivapi.com/,Entertainment
TVMaze,TV Show Data,http://www.tvmaze.com/api,Entertainment
Hypixel,Hypixel player stats,https://api.hypixel.net/,Entertainment
mod.io,Cross Platform Mod API,https://docs.mod.io,Entertainment
Breaking Bad Quotes,Some Breaking Bad quotes,https://github.com/shevabam/breaking-bad-quotes,Entertainment
Harry Potter,Harry Potter API,https://www.potterapi.com/,Entertainment
Open Movie Database,Movie information,http://www.omdbapi.com/,Entertainment
IGDB.com,Video Game Database,https://api.igdb.com/,Entertainment
Lolwallpapers Api,League of Legends Wallpapers website official API.,https://api.lolwallpapers.net/,Entertainment
SpaceTradersAPI,rel=pub-apis) | ,https://spacetraders.io?rel=pub-apis,Entertainment
Scryfall,Magic: The Gathering database,https://scryfall.com/docs/api,Entertainment
Chuck Norris Database,Jokes,http://www.icndb.com/api/,Entertainment
Fortnite,Fortnite Stats,https://fortnitetracker.com/site-api,Entertainment
Jservice,Jeopardy Question Database,http://jservice.io,Entertainment
Comic Vine,Comics,https://comicvine.gamespot.com/api/documentation,Entertainment
TVDB,Television data,https://api.thetvdb.com/swagger,Entertainment
Hytale,Hytale blog posts and jobs,https://hytale-api.com/,Entertainment
Tronald Dump,The dumbest things Donald Trump has ever said,https://www.tronalddump.io/,Entertainment
Ron Swanson Quotes,Television,https://github.com/jamesseanwright/ron-swanson-quotes#ron-swanson-quotes-api,Entertainment
Psychonauts,Psychonauts World Characters Information and PSI Powers,https://psychonauts-api.netlify.app/,Entertainment
GW2Spidy,"GW2Spidy API, Items data on the Guild Wars 2 Trade Market",https://github.com/rubensayshi/gw2spidy/wiki,Entertainment
An API of Ice And Fire,Game Of Thrones API,https://anapioficeandfire.com/,Entertainment
TMDb,Community-based movie data,https://www.themoviedb.org/documentation/api,Entertainment
The Star Wars Api,"All the Star Wars data you've ever wanted: Planets, Spaceships, Vehicles, People, Films and Species.",https://swapi.co/,Entertainment
Final Space,Final Space API,https://finalspaceapi.com/docs/,Entertainment
xkcd,Retrieve xkcd comics as JSON,https://xkcd.com/json.html,Entertainment
RuneScape,RuneScape and OSRS RPGs information,https://runescape.wiki/w/Application_programming_interface,Entertainment
PandaScore,E-sports games and results,https://developers.pandascore.co/,Entertainment
Pokémon TCG,Pokémon TCG Information,https://pokemontcg.io,Entertainment
Giant Bomb,Video Games,https://www.giantbomb.com/api/documentation,Entertainment
Vimeo,Vimeo Developer API,https://developer.vimeo.com/,Entertainment
Dailymotion,Dailymotion Developer API,https://developer.dailymotion.com/,Entertainment
Steam,Steam Client Interaction,https://developer.valvesoftware.com/wiki/Steam_Web_API,Entertainment
PlayerUnknown's Battlegrounds,PUBG Stats,https://pubgtracker.com/site-api,Entertainment
Dark Souls 3,Information about Dark Souls 3 Items,https://blog.mugenmonkey.com/2017/09/10/ds3-api.html,Entertainment
Clash of Clans,Clash of Clans Game Information,https://developer.clashofclans.com,Entertainment
Magic The Gathering,Magic The Gathering Game Information,http://magicthegathering.io/,Entertainment
The Lord Of The Rings Api,"The one API serves your needs regarding data about The Lord of the Rings, the epic books by J. R. R. Tolkien and the movie adaptions by Peter Jackson. It provides information about the books, the movie trilogy, many characters and quotes.",https://the-one-api.dev/,Entertainment
CheapShark,Steam/PC Game Prices and Deals,https://www.cheapshark.com/api,Entertainment
The Lord of the Rings,The Lord of the Rings API,https://the-one-api.dev/,Entertainment
Halo,Halo 5 and Halo Wars 2 Information,https://developer.haloapi.com/,Entertainment
Open Trivia,Trivia Questions,https://opentdb.com/api_config.php,Entertainment
Fortnite Api,A fortnite tracker api that returns data about and account,https://fortnite-api.com/,Entertainment
MCU Countdown,A Countdown to the next MCU Film,https://github.com/DiljotSG/MCU-Countdown,Entertainment
Dota 2,"Provides information about Player stats , Match stats, Rankings for Dota 2",https://docs.opendota.com/,Entertainment
FreeToGame,Free-To-Play Games Database,https://www.freetogame.com/api-doc,Entertainment
Dungeons and Dragons,"Reference for 5th edition spells, classes, monsters, and more",http://www.dnd5eapi.co/,Entertainment
Clash Royale,Clash Royale Game Information,https://developer.clashroyale.com,Entertainment
Jokes One,Joke of the day and large category of jokes accessible via REST API,https://jokes.one/api/joke/,Entertainment
Age of Empires II,Get information about Age of Empires II resources,https://age-of-empires-2-api.herokuapp.com,Entertainment
Lichess,"Access to all data of users, games, puzzles and etc on Lichess",https://lichess.org/api,Entertainment
Rick and Morty,"All the Rick and Morty information, including images",https://rickandmortyapi.com,Entertainment
SWAPI,All things Star Wars,https://www.swapi.tech,Entertainment
Jokes,Programming and general jokes,https://github.com/15Dkatz/official_joke_api,Entertainment
Trakt,Movie and TV Data,https://trakt.tv/b/api-docs,Entertainment
Czech Television,TV programme of Czech TV,http://www.ceskatelevize.cz/xml/tv-program/,Entertainment
FIFA Ultimate Team,FIFA Ultimate Team items API,https://www.easports.com/fifa/ultimate-team/api/fut/item,Entertainment
ErosNow,API for Bollywood films and many more,https://erosnow.com/developers/api/,Entertainment
Humble Bundle,Humble Bundle's current bundles,https://rapidapi.com/Ziggoto/api/humble-bundle,Entertainment
Hyrule Compendium,Data on all interactive items from The Legend of Zelda: BOTW,https://github.com/gadhagod/Hyrule-Compendium-API,Entertainment
Pokéapi,Pokémon Information,https://pokeapi.co,Entertainment
Breaking Bad,Breaking Bad API,https://breakingbadapi.com/documentation,Entertainment
Riot Games,League of Legends Game Information,https://developer.riotgames.com/,Entertainment
Mario Kart Tour,"API for Drivers, Karts, Gliders and Courses",https://mario-kart-tour-api.herokuapp.com/,Entertainment
JokeAPI,"Programming, Miscellaneous and Dark Jokes",https://sv443.net/jokeapi/v2/,Entertainment
SuperHeroes,All SuperHeroes and Villains data from all universes under a single API,https://superheroapi.com,Entertainment
The Vampire Diaries,TV Show Data,https://vampire-diaries-api.netlify.app/,Entertainment
Guild Wars 2,Guild Wars 2 Game Information,https://wiki.guildwars2.com/wiki/API:Main,Entertainment
Autochess VNG,Rest Api for Autochess VNG,https://github.com/didadadida93/autochess-vng-api,Entertainment
TCGdex,Multi languages Pokémon TCG Information,https://www.tcgdex.net/docs,Entertainment
Brawl Stars,Brawl Stars Game Information,https://developer.brawlstars.com,Entertainment
Eve Online,Third-Party Developer Documentation,https://esi.evetech.net/ui,Entertainment
AmiiboAPI,Nintendo Amiibo Information,https://amiiboapi.com/,Entertainment
Wargaming.net,Wargaming.net info and stats,https://developers.wargaming.net/,Entertainment
STAPI,Information on all things Star Trek,http://stapi.co,Entertainment
GamerPower,Game Giveaways Tracker,https://www.gamerpower.com/api-read,Entertainment
Barter.VG,"Provides information about Game, DLC, Bundles, Giveaways, Trading",https://github.com/bartervg/barter.vg/wiki,Entertainment
YouTube,Add YouTube functionality to your sites and apps,https://developers.google.com/youtube/,Entertainment
Game of Thrones Quotes,Some Game of Thrones quotes,https://gameofthronesquotes.xyz/,Entertainment
Destiny The Game,Bungie Platform API,https://github.com/Bungie-net/api,Entertainment
Marvel,Marvel Comics,http://developer.marvel.com,Entertainment
Board Game Geek,"Board games, RPG and videogames",https://boardgamegeek.com/wiki/page/BGG_XML_API2,Entertainment
Movie Quote,Random Movie and Series Quotes,https://github.com/F4R4N/movie-quote/,Entertainment
GitHub,"Make use of GitHub repositories, code and user info programmatically",https://docs.github.com/en/free-pro-team@latest/rest,Development
SHOUTCLOUD,ALL-CAPS AS A SERVICE,http://shoutcloud.io/,Development
Browshot,"Easily make screenshots of web pages in any screen size, as any device",https://browshot.com/api/documentation,Development
Ciprand,Secure random string generator,https://github.com/polarspetroll/ciprand,Development
Nationalize.io,Estimate the nationality of a first name,https://nationalize.io,Development
import.io,Retrieve structured data from a website or RSS feed,http://api.docs.import.io/,Development
Gorest,Online REST API for Testing and Prototyping,https://gorest.co.in/,Development
IBM Text to Speech,Convert text to speech,https://cloud.ibm.com/docs/text-to-speech/getting-started.html,Development
Tyk,Api and service management platform,https://tyk.io/open-source/,Development
Agify.io,Estimates the age from a first name,https://agify.io,Development
ScrapingDog,Proxy API for Web scraping,https://www.scrapingdog.com/,Development
Scraper.AI,Extract and monitor data from any website,https://docs.scraper.ai/#/,Development
jsDelivr,Package info and download stats on jsDelivr CDN,https://github.com/jsdelivr/data.jsdelivr.com,Development
Serialif Color,"Color conversion, complementary, grayscale and contrasted text",https://color.serialif.com/,Development
GETPing,Trigger an email notification with a simple GET request,https://www.getping.info,Development
Pusher Beams,Push notifications for Android & iOS,https://pusher.com/beams,Development
ExtendsClass JSON Storage,A simple JSON store API,https://extendsclass.com/json-storage.html,Development
MicroENV,Fake Rest API for developers,https://microenv.com/,Development
Httpbin Cloudflare,A Simple HTTP Request & Response Service with HTTP/3 Support by Cloudflare,https://cloudflare-quic.com/b/,Development
CDNJS,Library info on CDNJS,https://api.cdnjs.com/libraries/jquery,Development
IFTTT,IFTTT Connect API,https://platform.ifttt.com/docs/connect_api,Development
ScraperApi,Easily build scalable web scrapers,https://www.scraperapi.com,Development
scraperBox,Undetectable web scraping API,https://scraperbox.com/,Development
Bored,Find random activities to fight boredom,https://www.boredapi.com/,Development
Bitbucket,Bitbucket API,https://developer.atlassian.com/bitbucket/api/2/reference/,Development
Blitapp,Schedule screenshots of web pages and sync them to your cloud,https://blitapp.com/api/,Development
Genderize.io,Estimates a gender from a first name,https://genderize.io,Development
QuickChart,Generate chart and graph images,https://quickchart.io/,Development
CountAPI,Free and simple counting service. You can use it to track page hits and specific events,https://countapi.xyz,Development
Host.io,Domains Data API for Developers,https://host.io,Development
JSON 2 JSONP,Convert JSON to JSONP (on-the-fly) for easy cross-domain data requests using client-side JavaScript,https://json2jsonp.com/,Development
Form2Channel,"Send static html form submissions to Google Sheets, Email, Slack or Telegram",https://form2channel.com/,Development
IP2WHOIS Information Lookup,WHOIS domain name lookup,https://www.ip2whois.com/,Development
IPinfo,Another simple IP Address API,https://ipinfo.io/developers,Development
DigitalOcean Status,Status of all DigitalOcean services,https://status.digitalocean.com/api,Development
ApiFlash,Chrome based screenshot API for developers,https://apiflash.com/,Development
24 Pull Requests,Project to promote open source collaboration during December,https://24pullrequests.com/api,Development
ReqRes,A hosted REST-API ready to respond to your AJAX requests,https://reqres.in/ ,Development
Statically,A free CDN for developers,https://statically.io/,Development
APIs.guru,"Wikipedia for Web APIs, OpenAPI/Swagger specs for public APIs",https://apis.guru/api-doc/,Development
RSS feed to JSON,Returns RSS feed in JSON format using feed URL,https://rss-to-json-serverless-api.vercel.app,Development
ApicAgent,Extract device details from user-agent string,https://www.apicagent.com,Development
Judge0,Compile and run source code,https://api.judge0.com/,Development
QR Code,Create new QR Code or decode existing one,https://fungenerators.com/api/qrcode/,Development
Hexabin,"Convert and retrieve hexadecimal, binary, decimal, and octal values with ease",https://hexabin.herokuapp.com/,Development
ProxyCrawl,Scraping and crawling anticaptcha service,https://proxycrawl.com,Development
Gitter,Chat for Developers,https://developer.gitter.im/docs/welcome,Development
host-t.com,Basic DNS query via HTTP GET request,https://host-t.com,Development
Postman,Tool for testing APIs,https://docs.api.getpostman.com/,Development
ScrapingAnt,Headless Chrome scraping with a simple API,https://scrapingant.com,Development
serpstack,Real-Time & Accurate Google Search Results API,https://serpstack.com/,Development
Gitlab,Automate GitLab interaction programmatically,https://docs.gitlab.com/ee/api/,Development
DomainDb Info,Domain name search to find all domains containing particular words/phrases/etc,https://api.domainsdb.info/,Development
StackExchange,Q&A forum for developers,https://api.stackexchange.com/,Development
HTTP2.Pro,Test endpoints for client and server HTTP/2 protocol support,https://http2.pro/doc/api,Development
Trending-Github,Discover what is currently trending on github,https://docs.trending-github.com,Development
License-API,Unofficial REST API for choosealicense.com,https://github.com/cmccandless/license-api/blob/master/README.md,Development
IPify,A simple IP Address API,https://www.ipify.org/,Development
OOPSpam,Multiple spam filtering service,https://oopspam.com/,Development
WebScraping.AI,Web Scraping API with built-in proxies and JS rendering,https://webscraping.ai/,Development
Glitterly,Image generation API,https://developers.glitterly.app,Development
Icanhazepoch,Get Epoch time,https://icanhazepoch.com,Development
JSONbin.io,"Free JSON storage service. Ideal for small scale Web apps, Websites and Mobile apps",https://jsonbin.io,Development
scrapestack,"Real-time, Scalable Proxy & Web Scraping REST API",https://scrapestack.com/,Development
Httpbin,A Simple HTTP Request & Response Service,https://httpbin.org/,Development
userstack,Secure User-Agent String Lookup JSON API,https://userstack.com/,Development
Public APIs,A collective list of free JSON APIs for use in web development,https://github.com/davemachado/public-api,Development
Kroki,Creates diagrams from textual descriptions,https://kroki.io,Development
ScreenshotAPI.net,Create pixel-perfect website screenshots,https://screenshotapi.net/,Development
PageCDN,"Public API for javascript, css and font libraries on PageCDN",https://pagecdn.com/docs/public-api,Development
Cloudflare Trace,"Get IP Address, Timestamp, User Agent, Country Code, IATA, HTTP Version, TLS/SSL Version & More",https://github.com/fawazahmed0/cloudflare-trace-api,Development
MAC address vendor lookup,Retrieve vendor details and other information regarding a given MAC address or an OUI,https://macaddress.io/api,Development
Icanhazip,IP Address API,https://major.io/icanhazip-com-faq/,Development
Changelogs.md,Structured changelog metadata from open source projects,https://changelogs.md,Development
QR code,Generate and decode / read QR code graphics,http://qrtag.net/api/,Development
Abstract Screenshot,Take programmatic screenshots of web pages from any website,https://www.abstractapi.com/website-screenshot-api,Development
Sport List & Data,List of and resources related to sports,https://developers.decathlon.com/products/sports,Sports
Wger,"Workout manager data as exercises, muscles or equipment",https://wger.de/en/software/api,Sports
balldontlie,Balldontlie provides access to stats data from the NBA,https://balldontlie.io,Sports
SuredBits,"Query sports data, including teams, players, games, scores and statistics",https://suredbits.com/api/,Sports
Ergast F1,F1 data from the beginning of the world championships in 1950,http://ergast.com/mrd/,Sports
MLB Records and Stats,Current and historical MLB statistics,https://appac.github.io/mlb-data-api-docs/,Sports
Football Prediction,"API that offers predictions for upcoming football (soccer) matches, odds and performance stats.",https://boggio-analytics.com/fp-api/,Sports
Canadian Football League (CFL),"Official JSON API providing real-time league, team and player statistics about the CFL",CFL,Sports
City Bikes,City Bikes around the world,http://api.citybik.es/v2/,Sports
Strava,"Connect with athletes, activities and more",https://strava.github.io/api/,Sports
TheSportsDB,Crowd-Sourced Sports Data and Artwork,https://www.thesportsdb.com/api.php,Sports
BikeWise,"Bikewise is a place to learn about and report bike crashes, hazards and thefts",https://www.bikewise.org/documentation/api_v2,Sports
NBA Stats,Current and historical NBA Statistics,https://any-api.com/nba_com/nba_com/docs/API_Description,Sports
Football (Soccer) Videos,"Embed codes for goals and highlights from Premier League, Bundesliga, Serie A and many more",Soccer,Sports
The Sports Db,"With the Sports DB API you can query teams, players in teams, player details, player contract details, and just about any player or team data from a broad range of sports (from soccer/football to handball)",https://www.thesportsdb.com/api.php,Sports
Football-Data.org,Football Data,http://api.football-data.org/index,Sports
JCDecaux Bike,JCDecaux's self-service bicycles,https://developer.jcdecaux.com/,Sports
Fitbit,Fitbit Information,https://dev.fitbit.com/,Sports
NHL Records and Stats,NHL historical data and statistics,https://gitlab.com/dword4/nhlapi,Sports
Mixcloud,Music,https://www.mixcloud.com/developers/,Music
Genrenator,Music genre generator,https://binaryjazz.us/genrenator-api/,Music
Genius,Crowdsourced lyrics and music knowledge,https://docs.genius.com/,Music
Apple Music,Official API of the music streaming site Apple Music,https://developer.apple.com/documentation/applemusicapi/,Music
LastFm,Music,https://www.last.fm/api,Music
SoundCloud API,"Discover, stream, and share a constantly expanding mix of music from emerging and major artists around the world.",https://developers.soundcloud.com/,Music
Songsterr,"Provides guitar, bass and drums tabs and chords",https://www.songsterr.com/a/wa/api/,Music
SoundCloud,Allow users to upload and share sounds,https://developers.soundcloud.com/,Music
Theaudiodb,Music,https://www.theaudiodb.com/,Music
Jamendo,Music,https://developer.jamendo.com/v3.0/docs,Music
TasteDive,Similar artist API (also works for movies and TV shows),https://tastedive.com/read/api,Music
KKBOX,"Get music libraries, playlists, charts, and perform out of KKBOX's platform",https://developer.kkbox.com,Music
Openwhyd,"Download curated playlists of streaming tracks YouTube, SoundCloud, etc...",https://openwhyd.github.io/openwhyd/API,Music
Bandsintown,Music Events,https://app.swaggerhub.com/apis/Bandsintown/PublicAPI/3.0.0,Music
7digital,Api of Music store 7digital,https://docs.7digital.com/reference,Music
Audiomack,Api of the streaming music hub Audiomack,https://www.audiomack.com/data-api/docs,Music
iTunes Search,Software products,https://affiliate.itunes.apple.com/resources/documentation/itunes-store-web-service-search-api/,Music
BlipFm,Api of BlipFm,http://api.blip.fm/,Music
Spotify,"View Spotify music catalog, manage users' libraries, get recommendations and more",https://developer.spotify.com/documentation/web-api/,Music
JioSaavn,"API to retrive song information, album meta data and many more from JioSaavn",https://github.com/cyberboysumanjay/JioSaavnAPI,Music
MusixMatch,Let’s you legally display lyrics of over 640k artists and 13M tracks on your app or website,https://developer.musixmatch.com/documentation,Music
Deezer,Music,https://developers.deezer.com/api,Music
KSoft.Si Lyrics,API to get lyrics for songs,https://docs.ksoft.si/api/lyrics-api,Music
Freesound,Music Samples,https://freesound.org/docs/api/,Music
MusicBrainz,Music,https://musicbrainz.org/doc/Development/XML_Web_Service/Version_2,Music
Lyrics.ovh,Simple API to retrieve the lyrics of a song,http://docs.lyricsovh.apiary.io/,Music
Bandcamp,API of Music store Bandcamp,https://bandcamp.com/developer,Music
Vagalume,Crowdsourced lyrics and music knowledge,https://api.vagalume.com.br/docs/,Music
Songkick,Music Events,https://www.songkick.com/developer/,Music
AI Mastering,Automated Music Mastering,https://aimastering.com/api_docs/,Music
Discogs,Music,https://www.discogs.com/developers/,Music
apilayer ipstack,Locate and identify website visitors by IP address,https://ipstack.com/,Location
Geocoding.ai,Provides worldwide forward / reverse geocoding,https://nominatim.geocoding.ai/,Location
US ZipCode,Validate and append data for any US ZipCode,https://smartystreets.com/docs/cloud/us-zipcode-api,Location
GeoDataSource,Geocoding of city name by using latitude and longitude coordinates,https://www.geodatasource.com/web-service,Location
IPGEO,Unlimited free IP Address API with useful information,https://api.techniknews.net/ipgeo/,Location
Zippopotam.us,"Get information about place such as country, city, state, etc",http://www.zippopotam.us,Location
Uebermaps,Discover and share maps with friends,https://uebermaps.com/api/v2,Location
OpenStreetMap,"Navigation, geolocation and geographical data",http://wiki.openstreetmap.org/wiki/API,Location
ZipCodeAPI,"US zip code distance, radius and location API",https://www.zipcodeapi.com,Location
Airtel IP,full=true) | ,https://sys.airtel.lv/ip2country/1.1.1.1/?full=true,Location
PostcodeData.nl,postcode=1211EP&streetnumber=60&ref=domeinnaam.nl&type=json) | ,http://api.postcodedata.nl/v1/postcode/?postcode=1211EP&streetnumber=60&ref=domeinnaam.nl&type=json,Location
Bing Maps,Create/customize digital maps based on Bing Maps data,https://www.microsoft.com/maps/,Location
Localizr,"Get a list of countries,currencies or locales translated from a locale/language code",https://docs.localizr.xyz,Location
OnWater,Determine if a lat/lon is on water or land,https://onwater.io/,Location
Postcodes.io,Postcode lookup & Geolocation for the UK,https://postcodes.io,Location
"One Map, Singapore",Singapore Land Authority REST API services for Singapore addresses,https://docs.onemap.sg/,Location
GeoNames,Place names and other geographical data,http://www.geonames.org/export/web-services.html,Location
IPInfoDB,"Free Geolocation tools and APIs for country, region, city and time zone lookup by IP address",https://ipinfodb.com/api,Location
Cep.la,"Brazil RESTful API to find information about streets, zip codes, neighborhoods, cities and states",http://cep.la/,Location
GeoJS,IP geolocation with ChatOps integration,https://geojs.io/,Location
HERE Maps,Create/customize digital maps based on HERE Maps data,https://developer.here.com,Location
Daum Maps,Daum Maps provide multiple APIs for Korean maps,http://apis.map.daum.net/,Location
GeoApi,French geographical data,https://api.gouv.fr/api/geoapi.html,Location
RoadGoat Cities,Cities content & photos API,https://www.roadgoat.com/business/cities-api,Location
geoPlugin,IP geolocation and currency conversion,https://www.geoplugin.com,Location
IP2Proxy,Detect proxy and VPN using IP address,https://www.ip2location.com/web-service/ip2proxy,Location
HelloSalut,Get hello translation following user language,https://www.fourtonfish.com/hellosalut/hello/,Location
Abstract IP Geolocation,Geolocate website visitors from their IPs,https://www.abstractapi.com/ip-geolocation-api,Location
OpenCage,Forward and reverse geocoding using open data,https://opencagedata.com,Location
ViaCep,Brazil RESTful zip codes API,https://viacep.com.br,Location
Geocodify.com,"Worldwide geocoding, geoparsing and autocomplete for addresses",https://geocodify.com/,Location
Cartes.io,Create maps and markers for anything,https://github.com/M-Media-Group/Cartes.io/wiki/API,Location
positionstack,Forward & Reverse Batch Geocoding REST API,https://positionstack.com/,Location
Google Maps,Create/customize digital maps based on Google Maps data,https://developers.google.com/maps/,Location
IP 2 Country,Map an IP to a country,https://ip2country.info,Location
Country,Get your visitors' country from their IP,http://country.is/,Location
IP Vigilante,Free IP Geolocation API,https://www.ipvigilante.com/,Location
Google Earth Engine,A cloud-based platform for planetary-scale environmental data analysis,https://developers.google.com/earth-engine/,Location
Geocod.io,Address geocoding / reverse geocoding in bulk,https://www.geocod.io/,Location
LocationIQ,Provides forward/reverse geocoding and batch geocoding,https://locationiq.org/docs/,Location
Ziptastic,"Get the country, state, and city of any US zip-code",https://ziptasticapi.com/,Location
Utah AGRC,Utah Web API for geocoding Utah addresses,https://api.mapserv.utah.gov,Location
REST Countries,Get information about countries via a RESTful API,https://restcountries.eu,Location
openrouteservice.org,"Directions, POIs, isochrones, geocoding (+reverse), elevation, and more",https://openrouteservice.org/,Location
Hong Kong GeoData Store,API for accessing geo-data of Hong Kong,https://geodata.gov.hk/gs/,Location
CountryStateCity,"World countries, states, regions, provinces, cities & towns in JSON, SQL, XML, YAML, & CSV format",https://countrystatecity.in/,Location
