name,description,link,category
Image-Charts,"Image-Charts API returns a chart image in response to a URL GET or POST request. The API can generate many kinds of charts, from pie or line charts to bar charts and radars. All the information about the chart that you want, such as chart data, size, colors, and labels, are part of the URL. It can generates animated gif as well!",https://www.image-charts.com/,Miscellaneous
Iplegit.Com,Simple and free to use IP lookup service. Get basic and detailed data on IP addresses. Two free endpoints available.,https://iplegit.com/,Miscellaneous
Cloudmersive,"Utility API platform with full access to expansive API Library including Document Conversion, Virus Scanning, and more with 800 calls/month.",https://api.cloudmersive.com/swagger/index.html?urls.primaryName=Convert%20API,Miscellaneous
Qrcode Monkey,Integrate custom and unique looking QR codes into your system or workflow. This API is perfect for creating thousands of high quality QR codes in png or svg vector format.,https://www.qrcode-monkey.com/qr-code-api-with-logo/,Miscellaneous
PlaceBear,Placeholder bear pictures,https://placebear.com/,Animals
Movebank,Movement and Migration data of animals,https://github.com/movebank/movebank-api-doc,Animals
Cataas,Cat as a service (cats pictures and gifs),https://cataas.com/,Animals
Cat Facts,Daily Car Facts,https://alexwohlbruck.github.io/cat-facts/,Animals
RandomFox,Random pictures of foxes,https://randomfox.ca/floof/,Animals
Dogs,,https://dog.ceo/dog-api/,Animals
Axolotl,Collection of axolotl pictures and facts,https://theaxolotlapi.netlify.app/,Animals
Shibe.Online,"Random pictures of Shiba Inu, cats or birds",http://shibe.online/,Animals
RandomCat,Random pictures of cats,https://aws.random.cat/meow,Animals
Httpcat,Cat for every HTTP Status,https://http.cat/,Animals
IUCN,IUCN Red List of Threatened Species,http://apiv3.iucnredlist.org/api/v3/docs,Animals
Cats,Pictures of cats from Tumblr,https://docs.thecatapi.com/,Animals
catAPI,Random pictures of cats,https://github.com/ThatCopy/catAPI/wiki/Usage,Animals
RescueGroups,Adoption,https://userguide.rescuegroups.org/display/APIDG/API+Developers+Guide+Home,Animals
Dog Facts,Random dog facts,https://dukengn.github.io/Dog-facts-API/,Animals
Randomdog,Random pictures of dogs,https://random.dog/,Animals
PlaceDog,Placeholder Dog pictures,https://place.dog,Animals
Bing Search API,"Add intelligent search to your app, combing hundreds of billions of webpages, images, videos, and news to provide relevant results with no ad requirements. The results can be automatically customized to your users' locations or markets, increasing relevancy by staying local.",https://redirect.microsoft/dataset/bing/search,Search
Jooble,Job search engine,https://jooble.org/api/about,Search
Jobs2careers,Job aggregator,https://api.jobs2careers.com/api/,Search
Foursquare API,Gives you access to our world-class places database and the ability to interact with Foursquare users and merchants. Start using the only location API you'll ever need.,https://developer.foursquare.com/,Search
News Feed Search,Free news search API. Easily search and filter news feeds to integrate them into your application. Add your own RSS feed and the application automatically downloads articles daily,https://imbrikapi.com/,Search
Robohash Image Generator,Generates cool looking robot image for any text,https://www.mashape.com/blaazetech/robohash-image-generator,Funny
Api Meme,Generate memes with a simple link!,https://apimeme.com/,Funny
Imgflip,"Get 100 of memes with Imgflip API, or add text/caption to memes directly from this awesome API.",https://imgflip.com/api,Funny
Adorable Avatars,Generate random cartoon avatars,http://avatars.adorable.io/,Funny
MEME Generator,"Let’s you generate memes by choosing preloaded images, and short top and bottom text sentences",http://version1.api.memegenerator.net/,Funny
Traveltime Api,Create polygons to show how far you can travel within a time limit. Calculate times from an origin to thousands of destinations in a single API call.,https://traveltime.com/docs/api/overview/introduction,Travel
IBM Watson Text To Speech,A really simple api that lets you convert text to speech. It’s 100% free for unlimited usage,https://www.ibm.com/thought-leadership/smart/,Audio
